{
  "$schema": "https://json-schema.org/draft/2020-12/schema",
  "$id": "https://github.com/aiinfra-capstone/llm-sched-study/contracts/schemas/cost_model.schema.json",
  "title": "C-3 \u2014 Cost model snapshot",
  "description": "The most load-bearing artifact. Divyansh Shukla (A) produces these; Aditya's live scheduler AND B's DES both consume them. This is where the two halves of the project actually meet.\n\nSnapshots are kept as a time-ordered series per calibration campaign. The series was required for H3, which would serve the scheduler a snapshot from s seconds ago; H3 is out of paper one (research plan section 5), so paper one reads one named snapshot per node and the series stays for M12.\n\nstochastic.autocorr_time_s is a measurement reported for characterisation (K6). The simulator does not read it: its noise is one lognormal multiplier per request with sigma from stochastic.sigma, independent across requests.\n\nON `form`: F-7 permits a lookup table OR a <=6-parameter regression. Pick ONE and commit at end of Week 2 \u2014 supporting both doubles B's interpolation logic for no research gain.",
  "type": "object",
  "required": [
    "cost_model_schema",
    "snapshot_id",
    "node_class",
    "measured_at_unix",
    "calibration_run_ids",
    "form",
    "entries",
    "stochastic",
    "admissibility",
    "provenance"
  ],
  "additionalProperties": false,
  "properties": {
    "cost_model_schema": {
      "type": "integer",
      "const": 1,
      "description": "\u00a712.2 mitigation: B's loader MUST reject unknown versions loudly rather than defaulting."
    },
    "snapshot_id": {
      "type": "string",
      "description": "e.g. cm_rtx3090_awq_20260428T1412Z. Referenced per-node from the run manifest (C-6)."
    },
    "node_class": {
      "type": "string",
      "description": "F-9: with engine and quantization held constant, a node class is defined by hardware PLUS engine_config (F-9a) \u2014 e.g. 'rtx3090_ngl99_p4_q4km'. Two machines of the same hardware running different -ngl are different node classes and need separate snapshots."
    },
    "measured_at_unix": {
      "type": "integer"
    },
    "calibration_run_ids": {
      "type": "array",
      "items": {
        "type": "string"
      }
    },
    "form": {
      "enum": [
        "lookup_table",
        "regression"
      ],
      "description": "F-7. Commit to one at end of Week 2."
    },
    "entries": {
      "type": "array",
      "minItems": 1,
      "items": {
        "type": "object",
        "required": [
          "prompt_bucket",
          "output_bucket",
          "concurrency",
          "service_ms_mean",
          "service_ms_p50",
          "service_ms_p95",
          "tokens_per_s",
          "n_samples"
        ],
        "additionalProperties": false,
        "properties": {
          "prompt_bucket": {
            "type": "array",
            "items": {
              "type": "integer"
            },
            "minItems": 2,
            "maxItems": 2
          },
          "output_bucket": {
            "type": "array",
            "items": {
              "type": "integer"
            },
            "minItems": 2,
            "maxItems": 2
          },
          "concurrency": {
            "type": "integer",
            "minimum": 1
          },
          "service_ms_mean": {
            "type": "number"
          },
          "service_ms_p50": {
            "type": "number"
          },
          "service_ms_p95": {
            "type": "number"
          },
          "prefill_ms_mean": {
            "type": "number",
            "minimum": 0,
            "description": "Mean of the engine-reported prefill span for this cell, in ms. Optional, and absent means the backend emitted no timings block for it.\n\nIt is here because prefill and decode do not respond to concurrency the same way, and a consumer that only has `service_ms_mean` cannot tell them apart. A simulator rescaling a request already in flight because the batch changed must not stretch the prompt evaluation: prefill is compute-bound and, under staggered arrivals, overlaps other requests' decode rather than their prefill.\n\nREAD THE CONCURRENCY COLUMN BEFORE USING THIS. The calibration grid holds `concurrency` requests in flight by firing them together, so at c>1 their prefills serialise against each other and this number carries that contention: 174 ms at c=1 against 592 ms at c=4 for the same 128-token prompt on the 1B GPU class. A Poisson workload does not synchronise arrivals that way and shows a flat ~180 ms at every batch size. The c=1 row is the uncontended prompt evaluation cost; the higher rows are a property of the calibration workload as much as of the hardware."
          },
          "decode_ms_mean": {
            "type": "number",
            "minimum": 0,
            "description": "Mean of the engine-reported decode span for this cell, in ms. Optional, on the same terms as `prefill_ms_mean`.\n\nUnlike prefill this one does behave across the grid: decode is memory-bound and per-request decode falls close to 1/c, so the value measured under synchronised arrivals matches what a staggered workload sees at the same batch size.\n\n`prefill_ms_mean + decode_ms_mean` is not `service_ms_mean`. The difference is the engine's unattributed residual, which is kept rather than distributed."
          },
          "tokens_per_s": {
            "type": "number"
          },
          "n_samples": {
            "type": "integer",
            "minimum": 1,
            "description": "Samples fitted into this cell: those served at the stated concurrency, or every sample of the cell when it is `thin`."
          },
          "thin": {
            "type": "boolean",
            "description": "True when no sample in this cell was served at the stated concurrency (the batch was always draining), so the cell is fitted from all of its samples and its service time is biased low. Optional; absent means the snapshot predates the field."
          }
        }
      }
    },
    "stochastic": {
      "type": "object",
      "description": "F-22: the DES service-time model MUST include a stochastic component fitted to observed throughput variance. The simulator multiplies each request's service time by exp(sigma Z - sigma^2 / 2), one draw per request, independent across requests, with no autocorrelation.",
      "required": [
        "model",
        "sigma",
        "autocorr_time_s",
        "fit_r2",
        "tau_resolved",
        "tau_censored"
      ],
      "properties": {
        "model": {
          "const": "lognormal_multiplier"
        },
        "sigma": {
          "type": "number",
          "minimum": 0
        },
        "autocorr_time_s": {
          "type": "number",
          "exclusiveMinimum": 0,
          "description": "tau, reported for characterisation (K6, MPR-1). The simulator does not read it. Meaningful only when `tau_resolved` is true: at the 5 s window floor it is a censored bound, not a measurement."
        },
        "fit_r2": {
          "type": "number"
        },
        "tau_resolved": {
          "type": "boolean",
          "description": "True when tau sits far enough above the resolution floor of the operating point (2x one request's duration) to be a measurement. Copied from the calibration run's stationarity report."
        },
        "tau_censored": {
          "type": "boolean",
          "description": "True when the autocorrelation showed no decay to fit, so `autocorr_time_s` is the one-window bound (the 5 s floor), not a fitted tau. Copied from the calibration run's stationarity report."
        }
      }
    },
    "admissibility": {
      "type": "object",
      "required": [
        "max_prompt",
        "max_output",
        "timeout_ceiling_ms"
      ],
      "properties": {
        "max_prompt": {
          "type": "integer"
        },
        "max_output": {
          "type": "integer"
        },
        "timeout_ceiling_ms": {
          "type": "integer"
        }
      }
    },
    "provenance": {
      "type": "object",
      "description": "The settings that eliminate the confounds, made auditable from the results. Under F-9 engine and quant are constant across the pool, so engine_config is what distinguishes one node class from another.",
      "required": [
        "engine",
        "engine_version",
        "quant",
        "gpu",
        "driver",
        "prefix_caching",
        "engine_config"
      ],
      "properties": {
        "engine": {
          "enum": [
            "llamacpp",
            "vllm"
          ],
          "description": "'llamacpp' for every pool node class. 'vllm' only for the F-9b engine-gap probe."
        },
        "engine_version": {
          "type": "string"
        },
        "quant": {
          "type": "string"
        },
        "gpu": {
          "type": "string"
        },
        "driver": {
          "type": "string"
        },
        "prefix_caching": {
          "type": "boolean"
        },
        "engine_config": {
          "type": "object",
          "description": "F-9a runtime parameters this snapshot was calibrated under. Must match the manifest's node block for any run that uses it.",
          "required": [
            "ngl",
            "threads",
            "parallel"
          ],
          "properties": {
            "ngl": {
              "type": "integer",
              "minimum": 0
            },
            "threads": {
              "type": "integer",
              "minimum": 1
            },
            "parallel": {
              "type": "integer",
              "minimum": 1
            }
          }
        }
      }
    }
  }
}
