{
  "cost_model_schema": 1,
  "snapshot_id": "cm_cpu_ngl0_p4_q4km_llama3_8b_20260830T143321Z_009",
  "node_class": "cpu_ngl0_p4_q4km_llama3_8b",
  "measured_at_unix": 1788100401,
  "calibration_run_ids": [
    "cal_cpu_ngl0_p4_q4km_llama3_8b_1788099741"
  ],
  "form": "lookup_table",
  "entries": [
    {
      "prompt_bucket": [
        1,
        128
      ],
      "output_bucket": [
        1,
        64
      ],
      "concurrency": 1,
      "service_ms_mean": 7891.885,
      "service_ms_p50": 7891.885,
      "service_ms_p95": 7906.388,
      "tokens_per_s": 7.3355,
      "n_samples": 2,
      "prefill_ms_mean": 1336.381,
      "decode_ms_mean": 6543.538
    },
    {
      "prompt_bucket": [
        1,
        128
      ],
      "output_bucket": [
        1,
        64
      ],
      "concurrency": 4,
      "service_ms_mean": 9380.201,
      "service_ms_p50": 9363.513,
      "service_ms_p95": 9921.602,
      "tokens_per_s": 3.9126,
      "n_samples": 76,
      "prefill_ms_mean": 2485.993,
      "decode_ms_mean": 6877.304
    }
  ],
  "stochastic": {
    "model": "lognormal_multiplier",
    "sigma": 0.03956,
    "autocorr_time_s": 69.4927,
    "fit_r2": 0.9885,
    "tau_resolved": false,
    "tau_censored": false
  },
  "admissibility": {
    "max_prompt": 128,
    "max_output": 64,
    "timeout_ceiling_ms": 300000
  },
  "provenance": {
    "engine": "llamacpp",
    "engine_version": "b10569+p1+cuda13.2",
    "quant": "Q4_K_M",
    "gpu": "none",
    "driver": "580.173.02",
    "prefix_caching": false,
    "engine_config": {
      "ngl": 0,
      "threads": 6,
      "parallel": 4
    }
  }
}
